{
  "id": "PASEC-8",
  "title": "Verify Skill Agent output with the executing executor",
  "status": "in_progress",
  "goal": "Make SkillAgentOrchestrator use SkillRuntime.executeVerified so the executor that produced output also verifies it before the Agent returns success.",
  "context": "SkillAgentOrchestrator currently calls execute() and then verify() as separate operations. Each operation resolves the executor independently, so registry changes between calls could cause output to be verified by a different implementation. SkillRuntime already provides executeVerified with same-instance verification.",
  "allowed_paths": [
    "Sources/Capabilities/Skills/SkillAgentOrchestrator.swift",
    "Tests/PersonalAgentTests/SkillExecutorRegistryTests.swift",
    "Tasks/active/PASEC-8.json"
  ],
  "forbidden_changes": [
    "Do not bypass policy or Agent scope checks.",
    "Do not return output when verification fails.",
    "Do not change executor registry first-registration-wins behavior.",
    "Do not modify App/ or Xcode project files."
  ],
  "acceptance_criteria": [
    "SkillAgentOrchestrator executes through SkillRuntime.executeVerified.",
    "Verifier rejection maps to SkillAgentOrchestratorError.verificationFailed for compatibility.",
    "A regression test proves Skill Agent execution fails when its executor rejects output.",
    "Existing Agent scope, policy, and cancellation behavior remain unchanged."
  ],
  "verification": [
    "python3 Scripts/agent_task_guard.py validate Tasks/active/PASEC-8.json",
    "python3 Scripts/agent_task_guard.py check-diff Tasks/active/PASEC-8.json --base origin/main",
    "swift test --disable-sandbox",
    "Confirm Swift package tests + repository integrity, macOS Xcode iOS arm64 build/unsigned IPA, and validate-contract CI gates."
  ],
  "dependencies": [
    "Issue #347",
    "Issue #354"
  ],
  "recovery": "Revert this single logical commit if existing Skill Agent error contracts or verified execution behavior regress."
}
