{
  "id": "PASTARTUP-1",
  "title": "Suppress stale startup errors after expected cancellation",
  "status": "in_progress",
  "goal": "Ensure expected cancellation during startup or view teardown cannot leave a stale error banner presented as a current Agent failure.",
  "context": "KernelSession.run already treats CancellationError, cancelled URLError, and ProviderRuntimeError.cancelled as non-fatal but retained the previous lastError value, which Settings and Agent surfaces render as attention required.",
  "allowed_paths": [
    "App/PersonalAgent/KernelSession.swift",
    "Tasks/active/PASTARTUP-1.json"
  ],
  "forbidden_changes": [
    "Do not suppress non-cancellation errors.",
    "Do not mark cancelled operations as successful or alter persisted runtime state."
  ],
  "acceptance_criteria": [
    "Each recognized cancellation path clears the stale lastError value.",
    "Non-cancellation errors continue to populate lastError.",
    "Agent Task Contract, M3, and Apple Native Build & Unsigned IPA pass."
  ],
  "verification": [
    "Review all run(_:) catch branches",
    "Agent Task Contract CI",
    "M3 and Apple Native Build & Unsigned IPA CI",
    "On-device cold launch with a cancelled model preparation does not show a stale Attention banner"
  ],
  "dependencies": [],
  "recovery": "Revert this single logical task if genuine errors become hidden or cancellation behavior regresses."
}
